{
  "schema": "godot-skin-slot-contract-v1",
  "manifestId": "synthetic-front-skin-pack-a",
  "view": "front",
  "canvas": {
    "width": 1024,
    "height": 1536
  },
  "skeleton": {
    "id": "generic-front-skeleton-v1",
    "bones": [
      {
        "id": "root_bone",
        "parent": null,
        "joint": {
          "x": 512,
          "y": 768
        },
        "pivot": {
          "x": 0.5,
          "y": 0.5
        },
        "drawOrder": -1,
        "allowedMotionEnvelope": {
          "rotationDeg": [
            -5,
            5
          ],
          "translation": {
            "x": [
              -8,
              8
            ],
            "y": [
              -8,
              8
            ]
          }
        }
      },
      {
        "id": "head_bone",
        "parent": null,
        "joint": {
          "x": 432,
          "y": 180
        },
        "pivot": {
          "x": 0.5,
          "y": 0.5
        },
        "drawOrder": 0,
        "allowedMotionEnvelope": {
          "rotationDeg": [
            -20,
            20
          ],
          "translation": {
            "x": [
              -24,
              24
            ],
            "y": [
              -24,
              24
            ]
          }
        }
      },
      {
        "id": "hair_back_bone",
        "parent": "root_bone",
        "joint": {
          "x": 592,
          "y": 250
        },
        "pivot": {
          "x": 0.5,
          "y": 0.5
        },
        "drawOrder": 1,
        "allowedMotionEnvelope": {
          "rotationDeg": [
            -20,
            20
          ],
          "translation": {
            "x": [
              -24,
              24
            ],
            "y": [
              -24,
              24
            ]
          }
        }
      },
      {
        "id": "hair_front_bone",
        "parent": "root_bone",
        "joint": {
          "x": 432,
          "y": 320
        },
        "pivot": {
          "x": 0.5,
          "y": 0.5
        },
        "drawOrder": 2,
        "allowedMotionEnvelope": {
          "rotationDeg": [
            -20,
            20
          ],
          "translation": {
            "x": [
              -24,
              24
            ],
            "y": [
              -24,
              24
            ]
          }
        }
      },
      {
        "id": "torso_bone",
        "parent": "root_bone",
        "joint": {
          "x": 592,
          "y": 390
        },
        "pivot": {
          "x": 0.5,
          "y": 0.5
        },
        "drawOrder": 3,
        "allowedMotionEnvelope": {
          "rotationDeg": [
            -20,
            20
          ],
          "translation": {
            "x": [
              -24,
              24
            ],
            "y": [
              -24,
              24
            ]
          }
        }
      },
      {
        "id": "upper_arm_l_bone",
        "parent": "root_bone",
        "joint": {
          "x": 432,
          "y": 460
        },
        "pivot": {
          "x": 0.5,
          "y": 0.5
        },
        "drawOrder": 4,
        "allowedMotionEnvelope": {
          "rotationDeg": [
            -20,
            20
          ],
          "translation": {
            "x": [
              -24,
              24
            ],
            "y": [
              -24,
              24
            ]
          }
        }
      },
      {
        "id": "upper_arm_r_bone",
        "parent": "root_bone",
        "joint": {
          "x": 592,
          "y": 530
        },
        "pivot": {
          "x": 0.5,
          "y": 0.5
        },
        "drawOrder": 5,
        "allowedMotionEnvelope": {
          "rotationDeg": [
            -20,
            20
          ],
          "translation": {
            "x": [
              -24,
              24
            ],
            "y": [
              -24,
              24
            ]
          }
        }
      },
      {
        "id": "forearm_l_bone",
        "parent": "root_bone",
        "joint": {
          "x": 432,
          "y": 600
        },
        "pivot": {
          "x": 0.5,
          "y": 0.5
        },
        "drawOrder": 6,
        "allowedMotionEnvelope": {
          "rotationDeg": [
            -20,
            20
          ],
          "translation": {
            "x": [
              -24,
              24
            ],
            "y": [
              -24,
              24
            ]
          }
        }
      },
      {
        "id": "forearm_r_bone",
        "parent": "root_bone",
        "joint": {
          "x": 592,
          "y": 670
        },
        "pivot": {
          "x": 0.5,
          "y": 0.5
        },
        "drawOrder": 7,
        "allowedMotionEnvelope": {
          "rotationDeg": [
            -20,
            20
          ],
          "translation": {
            "x": [
              -24,
              24
            ],
            "y": [
              -24,
              24
            ]
          }
        }
      },
      {
        "id": "hand_l_bone",
        "parent": "root_bone",
        "joint": {
          "x": 432,
          "y": 740
        },
        "pivot": {
          "x": 0.5,
          "y": 0.5
        },
        "drawOrder": 8,
        "allowedMotionEnvelope": {
          "rotationDeg": [
            -20,
            20
          ],
          "translation": {
            "x": [
              -24,
              24
            ],
            "y": [
              -24,
              24
            ]
          }
        }
      },
      {
        "id": "hand_r_bone",
        "parent": "root_bone",
        "joint": {
          "x": 592,
          "y": 810
        },
        "pivot": {
          "x": 0.5,
          "y": 0.5
        },
        "drawOrder": 9,
        "allowedMotionEnvelope": {
          "rotationDeg": [
            -20,
            20
          ],
          "translation": {
            "x": [
              -24,
              24
            ],
            "y": [
              -24,
              24
            ]
          }
        }
      },
      {
        "id": "thigh_l_bone",
        "parent": "root_bone",
        "joint": {
          "x": 432,
          "y": 880
        },
        "pivot": {
          "x": 0.5,
          "y": 0.5
        },
        "drawOrder": 10,
        "allowedMotionEnvelope": {
          "rotationDeg": [
            -20,
            20
          ],
          "translation": {
            "x": [
              -24,
              24
            ],
            "y": [
              -24,
              24
            ]
          }
        }
      },
      {
        "id": "thigh_r_bone",
        "parent": "root_bone",
        "joint": {
          "x": 592,
          "y": 950
        },
        "pivot": {
          "x": 0.5,
          "y": 0.5
        },
        "drawOrder": 11,
        "allowedMotionEnvelope": {
          "rotationDeg": [
            -20,
            20
          ],
          "translation": {
            "x": [
              -24,
              24
            ],
            "y": [
              -24,
              24
            ]
          }
        }
      },
      {
        "id": "shin_l_bone",
        "parent": "root_bone",
        "joint": {
          "x": 432,
          "y": 1020
        },
        "pivot": {
          "x": 0.5,
          "y": 0.5
        },
        "drawOrder": 12,
        "allowedMotionEnvelope": {
          "rotationDeg": [
            -20,
            20
          ],
          "translation": {
            "x": [
              -24,
              24
            ],
            "y": [
              -24,
              24
            ]
          }
        }
      },
      {
        "id": "shin_r_bone",
        "parent": "root_bone",
        "joint": {
          "x": 592,
          "y": 1090
        },
        "pivot": {
          "x": 0.5,
          "y": 0.5
        },
        "drawOrder": 13,
        "allowedMotionEnvelope": {
          "rotationDeg": [
            -20,
            20
          ],
          "translation": {
            "x": [
              -24,
              24
            ],
            "y": [
              -24,
              24
            ]
          }
        }
      },
      {
        "id": "foot_l_bone",
        "parent": "root_bone",
        "joint": {
          "x": 432,
          "y": 1160
        },
        "pivot": {
          "x": 0.5,
          "y": 0.5
        },
        "drawOrder": 14,
        "allowedMotionEnvelope": {
          "rotationDeg": [
            -20,
            20
          ],
          "translation": {
            "x": [
              -24,
              24
            ],
            "y": [
              -24,
              24
            ]
          }
        }
      },
      {
        "id": "foot_r_bone",
        "parent": "root_bone",
        "joint": {
          "x": 592,
          "y": 1230
        },
        "pivot": {
          "x": 0.5,
          "y": 0.5
        },
        "drawOrder": 15,
        "allowedMotionEnvelope": {
          "rotationDeg": [
            -20,
            20
          ],
          "translation": {
            "x": [
              -24,
              24
            ],
            "y": [
              -24,
              24
            ]
          }
        }
      }
    ]
  },
  "slots": [
    {
      "id": "head",
      "boneId": "head_bone",
      "z": 0,
      "articulates": false,
      "requiresHiddenFill": false,
      "geometryGroup": "core-v1",
      "attachments": [
        {
          "id": "head-visible-a",
          "role": "visible",
          "path": "fixtures/skin-pack-a/head-visible.png",
          "bytes": 74,
          "sha256": "b35fa69ec66686afb54691fb82148391ed8294b560efb285c8b7ddba2708091f",
          "dimensions": {
            "width": 4,
            "height": 4
          },
          "alphaBounds": {
            "x": 0,
            "y": 0,
            "width": 4,
            "height": 4
          },